{
  "fileId": "file-1",
  "timestamp": 1771000000000,
  "tolerance": 0.5,
  "summary": {
    "total": 3,
    "info": 1,
    "warning": 1,
    "error": 1
  },
  "issues": [
    {
      "id": "issue-1",
      "type": "unclosed_contour",
      "level": "info",
      "message": "轮廓不封闭",
      "fileId": "file-1",
      "entities": ["ent-1"],
      "location": {
        "position": { "x": 10, "y": 20 },
        "radius": 12
      }
    }
  ],
  "recommendations": ["建议先封闭轮廓"]
}
